"Article Title","Article URL","Article Content","Featured Image","Related Article Title","Related Article URL","Related Article Image"
"Advanced Composition Explorer","https://astrobiology.nasa.gov/missions/ace/","Observing solar, interplanetary, interstellar, and galactic origins.","https://astrobiology.nasa.gov/uploads/filer_public_thumbnails/filer_public/26/33/2633edbf-d2e4-401c-834f-745fa038d0e2/798_ace_1.jpg__620x300_q85_crop_subject_location-521%2C392_subsampling-2.jpg","","",""
"Atacama Large Millimeter/submillimeter Array","https://astrobiology.nasa.gov/missions/alma/","The most powerful Earth observatory in history","https://astrobiology.nasa.gov/uploads/filer_public_thumbnails/filer_public/d9/95/d995236a-e702-478f-a412-aa37ac327943/four_antennas_alma.jpg__620x300_q85_crop_subject_location-620%2C254_subsampling-2.jpg","","",""
"Chandra X-Ray Observatory","https://astrobiology.nasa.gov/missions/chandra/","NASA's flagship mission for X-ray astronomy.","https://astrobiology.nasa.gov/uploads/filer_public_thumbnails/filer_public/4a/ac/4aac01b0-29f5-4aa7-82fa-a13967e7ccc0/chandra_.jpg__620x300_q85_crop_subject_location-731%2C484_subsampling-2.jpg","","",""
"Europa Clipper Mission","https://astrobiology.nasa.gov/missions/europa-clipper/","Europa Clipper will conduct detailed reconnaissance of Jupiter's moon Europa and investigate whether the icy moon could harbor conditions suitable for life.","https://astrobiology.nasa.gov/uploads/filer_public_thumbnails/filer_public/a3/58/a358283d-339f-4f72-b91d-05e13af28d46/europa_hero.jpg__620x300_q85_crop_subject_location-620%2C254_subsampling-2.jpg","","",""
"Gaia Space Observatory","https://astrobiology.nasa.gov/missions/gaia-space-observatory/","Capturing a three-dimensional map of our Galaxy","https://astrobiology.nasa.gov/uploads/filer_public_thumbnails/filer_public/48/5f/485fedff-acf9-4d62-b817-4ede5fcb0240/artist_s_impression_of_gaia.jpg__620x300_q85_crop_subject_location-465%2C290_subsampling-2.jpg","","",""
"Gemini Observatory","https://astrobiology.nasa.gov/missions/gemini-north-and-gemini-south/","Exploring the Universe, Sharing its Wonders","https://astrobiology.nasa.gov/uploads/filer_public_thumbnails/filer_public/c8/0e/c80e7bea-ffa4-49ca-b08d-8b510f965455/20090604_gn_sunset_stars.jpg__620x300_q85_crop_subject_location-500%2C333_subsampling-2.jpg","","",""
"Hubble Space Telecope","https://astrobiology.nasa.gov/missions/hubble-space-telecope/","Hubble has provided observations of everything from distant galaxies to nearby planets in our own Solar System.","https://astrobiology.nasa.gov/uploads/filer_public_thumbnails/filer_public/87/15/8715a2fd-b4c0-4fbf-8458-9ce85b8f99ee/hubble1997_hi_0.jpg__620x300_q85_crop_subsampling-2.jpg","","",""
"James Webb Space Telescope","https://astrobiology.nasa.gov/missions/jwst/","Webb will be used to hunt for solar systems capable of supporting habitable planets.","https://astrobiology.nasa.gov/uploads/filer_public_thumbnails/filer_public/90/d4/90d4fd87-9982-4446-ab59-9e1e74f25287/jwst_614445main_013526_white2.jpg__620x300_q85_crop_subsampling-2.jpg","","",""
"Juno","https://astrobiology.nasa.gov/missions/juno/","Juno will improve our understanding of the solar system's beginnings by revealing the origin and evolution of Jupiter.","https://astrobiology.nasa.gov/uploads/filer_public_thumbnails/filer_public/8c/a9/8ca9f041-48b5-4416-abb4-c529c6f0a4fa/pia20703.jpg__620x300_q85_crop_subject_location-1042%2C621_subsampling-2.jpg","","",""
"JUpiter ICy moons Explorer","https://astrobiology.nasa.gov/missions/juice/","JUICE (JUpiter ICy moons Explorer) will explore Jupiter and three of its icy moons in depth.","https://astrobiology.nasa.gov/uploads/filer_public_thumbnails/filer_public/d4/c5/d4c56e7f-9ed0-497f-8042-0e3561fcf3e1/juice-spacecraft-image-16.jpg__620x300_q85_crop_subject_location-800%2C453_subsampling-2.jpg","","",""
"Lunar Reconnaissance Orbiter","https://astrobiology.nasa.gov/missions/lro/","Map the Moon's surface like never before.","https://astrobiology.nasa.gov/uploads/filer_public_thumbnails/filer_public/da/51/da518002-1fa2-4634-a5fa-cbb14ecddda1/pia18163_hires.jpg__620x300_q85_crop_subject_location-910%2C511_subsampling-2.jpg","","",""
"Mars 2020 Mission","https://astrobiology.nasa.gov/missions/2020-mars-rover/","The Mars 2020 mission's Perseverance Rover will provide details about the potential for life on Mars, both past and present.","https://astrobiology.nasa.gov/uploads/filer_public_thumbnails/filer_public/1b/47/1b478e2b-b601-4dea-bd0c-5971837003f9/pia24092-16.jpg__620x300_q85_crop_subject_location-800%2C450_subsampling-2.jpg","","",""
"Mars Atmosphere and Volatile Evolution","https://astrobiology.nasa.gov/missions/maven/","MAVEN is studying how atmospheric loss triggered the disappearance of liquid water on the surface of Mars.","https://astrobiology.nasa.gov/uploads/filer_public_thumbnails/filer_public/ac/3e/ac3e332b-234b-43f3-9f02-291e24f04303/img-1.jpg__620x300_q85_crop_subject_location-310%2C151_subsampling-2.jpg","","",""
"Mars Odyssey","https://astrobiology.nasa.gov/missions/mars-odyssey/","Mars Odyssey provides detailed maps of Mars that are used to determine the evolution of the Mars environment and its potential for life.","https://astrobiology.nasa.gov/uploads/filer_public_thumbnails/filer_public/78/0a/780a3cac-dcd6-4fe3-9313-83421cf3fabe/pia04816-br2.jpg__620x300_q85_crop_subsampling-2.jpg","","",""
"Mars Reconnaissance Orbiter","https://astrobiology.nasa.gov/missions/mro/","A Mission to Study the History of Water on Mars","https://astrobiology.nasa.gov/uploads/filer_public_thumbnails/filer_public/9c/7e/9c7e3178-4e87-4bd4-b23e-9df355d099a1/mro.jpg__620x300_q85_crop_subject_location-1646%2C1097_subsampling-2.jpg","","",""
"Mars Science Laboratory","https://astrobiology.nasa.gov/missions/msl/","MSL's Curiosity rover is studying whether or not Mars ever had environments capable of supporting microbial life.","https://astrobiology.nasa.gov/uploads/filer_public_thumbnails/filer_public/0a/3f/0a3fd19c-d428-463c-bef4-69dcfbd5f059/pia19142_malhi-mojave.jpg__620x300_q85_crop_subsampling-2.jpg","","",""
"NASA Infrared Telescope Facility","https://astrobiology.nasa.gov/missions/nasa-irtf/","Provide vital and unequaled capabilities in planetary research while supporting NASA's flight missions and Strategic Goal for Planetary Science","https://astrobiology.nasa.gov/uploads/filer_public_thumbnails/filer_public/78/b6/78b66304-8679-406f-8260-59b36c85bb65/173472main_20070403_irtf2_070228180913.jpg__620x300_q85_crop_subject_location-640%2C360_subsampling-2.jpg","","",""
"New Horizons","https://astrobiology.nasa.gov/missions/new-horizons/","The First Mission to the Pluto System and the Kuiper Belt","https://astrobiology.nasa.gov/uploads/filer_public_thumbnails/filer_public/54/1f/541ff468-8127-4434-a352-8bef1a7af834/nh-surface-2.jpg__620x300_q85_crop_subject_location-1279%2C1609_subsampling-2.jpg","","",""
"Origins, Spectral Interpretation, Resource Identification, Security, Regolith Explorer","https://astrobiology.nasa.gov/missions/osiris-rex/","OSIRIS-REx is NASA's first sample return mission to an asteroid.","https://astrobiology.nasa.gov/uploads/filer_public_thumbnails/filer_public/cf/5d/cf5d58c2-7eb2-46a3-a584-a7d76c13c7a8/rex1.jpg__620x300_q85_crop_subsampling-2.jpg","","",""
"Spectro-Photometer for the History of the Universe, Epoch of Reionization and Ices Explorer","https://astrobiology.nasa.gov/missions/spherex/","An All-Sky Spectral Survey","https://astrobiology.nasa.gov/uploads/filer_public_thumbnails/filer_public/d7/a5/d7a52ff3-7e61-40f7-8eb9-11f36af63124/spherex.jpg__620x300_q85_crop_subject_location-1500%2C843_subsampling-2.jpg","","",""
"The Habitable Zone Planet Finder","https://astrobiology.nasa.gov/missions/hpf/","Highest precision measurements of infrared signals from nearby stars.","https://astrobiology.nasa.gov/uploads/filer_public_thumbnails/filer_public/8e/6b/8e6b2dd2-28b0-4dd4-9c61-b355889f7259/hpf_low2_lr.jpg__620x300_q85_crop_subject_location-365%2C202_subsampling-2.jpg","","",""
"Transiting Exoplanet Survey Satellite","https://astrobiology.nasa.gov/missions/tess/","The first-ever spaceborne all-sky transit survey.","https://astrobiology.nasa.gov/uploads/filer_public_thumbnails/filer_public/c7/ff/c7ff6639-b40b-4247-8a1c-45f3a96fefba/tessbeautypass.jpg__620x300_q85_crop_subject_location-620%2C254_subsampling-2.jpg","","",""
"Voyager 1 and Voyager 2","https://astrobiology.nasa.gov/missions/voyager-2/","Voyager Interstellar Mission","https://astrobiology.nasa.gov/uploads/filer_public_thumbnails/filer_public/bf/fa/bffa9685-ba82-4989-89f5-8019c9e0c998/pia17462_ip.jpg__620x300_q85_crop_subsampling-2.jpg","","",""
"W.M. Keck Observatory","https://astrobiology.nasa.gov/missions/keck/","Exploring the local and distant Universe","https://astrobiology.nasa.gov/uploads/filer_public_thumbnails/filer_public/89/b6/89b67bb2-b914-4ff6-97c0-139bf0d72fdb/_33r0275-198-2246418805-o.jpg__620x300_q85_crop_subject_location-620%2C254_subsampling-2.jpg","","",""
"Dragonfly","https://astrobiology.nasa.gov/missions/dragonfly/","Flights of exploration across Saturn's moon Titan","https://astrobiology.nasa.gov/uploads/filer_public_thumbnails/filer_public/63/40/63403b83-1bed-465f-a90d-9b53e88dda50/df-measurements.png__620x300_q85_crop_subject_location-960%2C539_subsampling-2.png","","",""
"Nancy Grace Roman Space Telescope","https://astrobiology.nasa.gov/missions/wfirst/","Studying dark energy, exoplanets, and infrared astrophysics","https://astrobiology.nasa.gov/uploads/filer_public_thumbnails/filer_public/bf/0f/bf0f31c0-46f3-41d2-ab42-31dece3fdb3b/wfirstmcrbaseline.jpg__620x300_q85_crop_subject_location-960%2C539_subsampling-2.jpg","","",""
"Rosalind Franklin ExoMars Rover","https://astrobiology.nasa.gov/missions/rosalind-franklin/","Establishing if life ever existed on Mars","https://astrobiology.nasa.gov/uploads/filer_public_thumbnails/filer_public/c6/f9/c6f9c8b7-25a9-4ea1-924b-0133e131f452/exomars2018_rover_20140321_9k.jpg__620x300_q85_crop_subsampling-2.jpg","","",""
"Apollo","https://astrobiology.nasa.gov/missions/apollo-11/","Apollo 11 was the first crewed lunar landing and return to Earth.","https://astrobiology.nasa.gov/uploads/filer_public_thumbnails/filer_public/42/51/4251e441-2088-4ba8-9c71-daa6126222dc/5873.jpg__620x300_q85_crop_subsampling-2.jpg","","",""
"Cassini-Huygens Saturn Orbiter and Titan Probe","https://astrobiology.nasa.gov/missions/cassini-huygens/","Cassini-Huygens reveals new details about the potential for life on moons around giant planets.","https://astrobiology.nasa.gov/uploads/filer_public_thumbnails/filer_public/eb/33/eb338435-c682-442a-9aa4-fbac586396e7/cassini.jpg__620x300_q85_crop_subject_location-620%2C254_subsampling-2.jpg","","",""
"Compton Gamma Ray Observatory","https://astrobiology.nasa.gov/missions/cgro/","Observing the high-energy Universe","https://astrobiology.nasa.gov/uploads/filer_public_thumbnails/filer_public/30/08/3008025f-6a08-417f-a7e6-62939f56de56/cgro.jpg__620x300_q85_crop_subject_location-620%2C596_subsampling-2.jpg","","",""
"Dawn","https://astrobiology.nasa.gov/missions/dawn/","Dawn provided new information about the early Solar System and formation of rocky planets by visiting protoplanets in the Main Asteroid Belt.","https://astrobiology.nasa.gov/uploads/filer_public_thumbnails/filer_public/84/06/840671a2-0236-4ad5-ae45-3fa2c0c50fb5/dawnmain_pia15174-640.jpg__620x300_q85_crop_subject_location-Vesta_subsampling-2.jpg","","",""
"Deep Impact","https://astrobiology.nasa.gov/missions/deep-impact/","Mission to a Comet","https://astrobiology.nasa.gov/uploads/filer_public_thumbnails/filer_public/ed/6e/ed6ebafd-715d-40e2-8f7d-b129be62bfbb/deep_impact_small.jpg__620x300_q85_crop_subject_location-311%2C240_subsampling-2.jpg","","",""
"Deep Impact Extended Investigation (DIXI) and Extrasolar Planet Observation and Characterization (EPOCh)","https://astrobiology.nasa.gov/missions/epoxi/","Two intriguing investigations -- One flight-proven spacecraft","https://astrobiology.nasa.gov/uploads/filer_public_thumbnails/filer_public/1f/86/1f86adb1-3060-4952-82d6-5c4682191449/epoxi20100628-full.jpg__620x300_q85_crop_subject_location-500%2C317_subsampling-2.jpg","","",""
"Galaxy Evolution Explorer","https://astrobiology.nasa.gov/missions/galex/","Understanding how the galaxies were formed","https://astrobiology.nasa.gov/uploads/filer_public_thumbnails/filer_public/24/3a/243a79ef-2e27-4e71-b9b9-f8ea93314964/glx2004-01r_img01.jpg__620x300_q85_crop_subject_location-1453%2C1806_subsampling-2.jpg","","",""
"Galileo mission","https://astrobiology.nasa.gov/missions/galileo/","Mission to Jupiter and its mysterious moons","https://astrobiology.nasa.gov/uploads/filer_public_thumbnails/filer_public/ce/6d/ce6d9d2c-ade3-45f6-b0d6-9f2fe99e9da8/pia21922.jpg__620x300_q85_crop_subject_location-1100%2C1461_subsampling-2.jpg","","",""
"Intelligent Payload Experiment","https://astrobiology.nasa.gov/missions/ipex/","Validating technologies for autonomous payload operations on a CubeSat","https://astrobiology.nasa.gov/uploads/filer_public_thumbnails/filer_public/b9/15/b915db9c-b112-4073-a0f0-c1aa9194fe19/cubesat20131206-640.jpg__620x300_q85_crop_subject_location-429%2C213_subsampling-2.jpg","","",""
"Interior Exploration using Seismic Investigations, Geodesy and Heat Transport","https://astrobiology.nasa.gov/missions/insight/","Insight into the early evolution of terrestrial planets.","https://astrobiology.nasa.gov/uploads/filer_public_thumbnails/filer_public/f9/da/f9da6c49-dc2f-4648-b732-3537fc1592e4/pia17358.jpg__620x300_q85_crop_subject_location-632%2C331_subsampling-2.jpg","","",""
"Kepler and K2","https://astrobiology.nasa.gov/missions/kepler/","Kepler data is used to search for Earth-sized planets around distant stars.","https://astrobiology.nasa.gov/uploads/filer_public_thumbnails/filer_public/e6/9c/e69c6f5c-38ee-4b29-befb-3b7e26403a8e/kepler_main.jpg__620x300_q85_crop_subsampling-2.jpg","","",""
"Lunar Atmosphere and Dust Environment Explorer","https://astrobiology.nasa.gov/missions/ladee/","LADEE provided new data about the lunar atmosphere and air-born dust.","https://astrobiology.nasa.gov/uploads/filer_public_thumbnails/filer_public/eb/dc/ebdcfe1c-38d3-4347-a46f-1668c47c9d00/ladee.jpg__620x300_q85_crop_subsampling-2.jpg","","",""
"Lunar Crater Observation and Sensing Satellite","https://astrobiology.nasa.gov/missions/lcross/","LCROSS identified water ice and a water cycle on the Moon, providing clues about how rocky bodies might become habitable for life.","https://astrobiology.nasa.gov/uploads/filer_public_thumbnails/filer_public/a3/36/a3366504-27d5-4640-b8b2-648deb3b2e36/226580main_2007-08-02_on_way_in.jpg__620x300_q85_crop_subsampling-2.jpg","","",""
"Mariner 4","https://astrobiology.nasa.gov/missions/mariner-4/","Mariner 4 returned the first pictures of the martian surface, and changed the way astrobiologists thought about life's potential on Mars.","https://astrobiology.nasa.gov/uploads/filer_public_thumbnails/filer_public/51/9d/519d62e6-7ef5-4e17-822a-7fec2315e906/mariner-4_image2.jpg__620x300_q85_crop_subject_location-578%2C336_subsampling-2.jpg","","",""
"Mars Exploration Rovers","https://astrobiology.nasa.gov/missions/mer/","The MER rovers have shaped our understanding of Mars' geology and past environments at the surface that may have been suitable for life.","https://astrobiology.nasa.gov/uploads/filer_public_thumbnails/filer_public/2f/c9/2fc96621-506c-4249-96db-1e3302b54d22/roving.jpg__620x300_q85_crop_subsampling-2.jpg","","",""
"MErcury Surface, Space ENvironment, GEochemistry, and Ranging","https://astrobiology.nasa.gov/missions/messenger/","Unlocking the mysteries of planet Mercury","https://astrobiology.nasa.gov/uploads/filer_public_thumbnails/filer_public/29/e3/29e3ac27-5d89-4a29-8f66-67b26f6a31a7/messenger.jpg__620x300_q85_crop_subject_location-310%2C151_subsampling-2.jpg","","",""
"Organism/Organic Exposure to Orbital Stresses","https://astrobiology.nasa.gov/missions/ooreos/","O/OREOS studies how living organisms are affected by the space environment.","https://astrobiology.nasa.gov/uploads/filer_public_thumbnails/filer_public/e6/7b/e67be81e-96d1-4a55-9a99-d54be2c1ba55/ooreos_deployed.jpg__620x300_q85_crop_subsampling-2.jpg","","",""
"Phoenix Mars Mission","https://astrobiology.nasa.gov/missions/phoenix/","Phoenix was designed to study the history of water and habitability potential in the Martian arctic's ice-rich soil.","https://astrobiology.nasa.gov/uploads/filer_public_thumbnails/filer_public/4d/89/4d8927fe-5a71-402b-abc3-65d87e1f6a37/228717main_pia07247_full.jpg__620x300_q85_crop_subject_location-2650%2C2145_subsampling-2.jpg","","",""
"Pioneer Venus Orbiter","https://astrobiology.nasa.gov/missions/pioneer-venus/","NASA's early missions to Venus helped to solidify the idea that Mars was a better place to look for potential past or present life.","https://astrobiology.nasa.gov/uploads/filer_public_thumbnails/filer_public/49/87/4987c5fa-6673-43f5-87d6-b1f47634edaa/pv_orbiter_small.jpg__620x300_q85_crop_subject_location-310%2C151_subsampling-2.jpg","","",""
"Spitzer Space Telescope","https://astrobiology.nasa.gov/missions/spitzer/","The Spitzer Space Telescope provides observations relevant to the search for habitable worlds around distant stars, and the study of astrobiology targets in our own solar system.","https://astrobiology.nasa.gov/uploads/filer_public_thumbnails/filer_public/fa/b3/fab3f3ff-e01c-4e99-a6ad-57b518006638/spitzer20130924.jpg__620x300_q85_crop_subsampling-2.jpg","","",""
"Stardust","https://astrobiology.nasa.gov/missions/stardust/","NASA's comet sample return mission","https://astrobiology.nasa.gov/uploads/filer_public_thumbnails/filer_public/31/16/31163709-68eb-4e28-8064-710bf6dd1773/stardust-43.jpg__620x300_q85_crop_subsampling-2.jpg","","",""
"Stratospheric Observatory for Infrared Astronomy","https://astrobiology.nasa.gov/missions/sofia/","SOFIA is making observations of new solar systems, complex molecules in space, and planets in our own Solar System.","https://astrobiology.nasa.gov/uploads/filer_public_thumbnails/filer_public/cf/17/cf176a78-3bde-4bf6-b3bf-3d08c69b4a67/sofia_landing_in_hamburg_6-28-14_0.jpg__620x300_q85_crop_subsampling-2.jpg","","",""
"Viking Project","https://astrobiology.nasa.gov/missions/viking-1-and-2/","NASA's Viking Project was the first mission to reach the martian surface and the first to search for evidence of life on Mars.","https://astrobiology.nasa.gov/uploads/filer_public_thumbnails/filer_public/f4/0d/f40d1ea2-f2c5-4e4f-add8-82ac6dcd9022/viking-carbajal-428-321.jpg__620x300_q85_crop_subsampling-2.jpg","","",""
